objectid,filename,youtubeid,title,creator,date,description,subject,location,latitude,longitude,source,identifier,type,format,language,rights,rightsstatement
demo_001,demo_001.jpg,,Michael Thonet,Commission impériale de l'exposition universelle de 1867,1867,"Photograph of Album des Exposants",exhibition;album;portrait;carte de visite,"Paris, France",48.189.329,16.337.148,"National Archive of France",1867_FRDAFAN81_OF12v0195_L-medium,"Image;Portrait",image/jpeg,eng,,"Property of Archives Nationales de France, Cote: F/12/11869, https://www.siv.archives-nationales.culture.gouv.fr/mm/media/download/FRDAFAN81_OF12v0195_L-medium.jpg"
demo_002,demo_002.jpg,,Michael Thonet?,Anonym, ca. 1855-1870,"Man with hat and beard standing beside a chair",portrait; man; hat; chair,"Vienna, Austria",48.210033,16.363449,"Private Collection of the author",Thonet005,Image;Portrait,image/jpeg,eng,,"The image is in posession of the author"
demo_003,demo_003.JPG,,Thonet No. 1,Thonet Company,1905,"Furniture Catalogue Netherlands from 1905",catalogue; furniture; print,"Amsterdam, Netherlands",52.377956,4.897070,"Museum für angewandte Kunst, MAK, Austria",1905_Katalog_Niederlande_AC110_LOG_0003_Seite_1,Image;Catalogue,image/jpeg,eng,,"https://hauspublikationen.mak.at/viewer/!image/AC110/4/-/"
demo_004,demo_004.JPG,No title,Anonym, 1840-1850, Man with tie sitting in an armchair, Portrait; Daguerrotype,"Barcelona, Spain",41380879 ,2172229,"Collecion Duran ; Museum of Science and Technology of Catalonia (MNACTEC)",1840-1850_daguerrotyp,Image;Portrait,image/jpeg,eng,Property of Museum of Science and Technology of Catalonia (MNACTEC), https://www.fotografiacatalunya.cat/en/catalog/images/5630cceeba82c93768a5f842  
demo_005,https://digital.lib.uidaho.edu/digital/iiif/expforsav/390/full/pct:50/0/default.jpg,,Ford pumper used for slash burning control,,1932-09-01,Ford pumper used for slash burning control. September 1932. From the photo series depicting the broadcast burn at the mouth of Benton Creek.,,"Bonner County;Priest River Experimental Forest;Benton Creek",48.34472222,-116.8483333,"The sources for the photos in this collection were as follows: Priest River Experimental Forest, Moscow Foresty Sciences Lab, USDA-Forest Service Region 1 archive, University of Montana Library Gisborne Collection, and Ms. Susan Marsh","FirePump1","Image;StillImage","image/jpeg",eng,"Material produced by the United States Forest Service and is in Public Domain. For more information, please contact University of Idaho Library Special Collections and Archives Department at libspec@uidaho.edu.","https://creativecommons.org/publicdomain/mark/1.0/"
